[
{"id":"ret:duy-integral-theorem","subject":"per:duy","statement":"RETRACTED. No source supports the existence of a \"Duy Integral Theorem\", or a proof that gradient descent discovers flat minima.","short":"RETRACTED — Duy Integral Theorem","reason":"The legacy agent prompt claims Duy 'Developed Duy Integral Theorem — a novel mathematical framework using measure theory and PDEs to explain neural network generalization' that 'Proves why gradient descent discovers flat minima'. Nothing in the fact ledger, the resume, the news archive or either repository supports it. A claimed theorem is the single most falsifiable thing a candidate can assert: a researcher who checks it and finds nothing discounts everything else on the page. If independent mathematical work exists, it enters the corpus as a NEW claim, described as what it actually is and sourced — never by reinstating this one.","forbiddenPhrases":["Duy Integral","integral theorem","proves why gradient descent","discovers flat minima"],"forbiddenPatterns":[],"retractedOn":"2026-09-02","previouslyAt":["backend/src/agent.py (SYSTEM_MESSAGE)","docs/index_independent_research.html (deleted in this rebuild)"],"supersededBy":[],"note":"The page that was its home, docs/index_independent_research.html, is deleted outright by the rebuild; its URL redirects and carries noindex."},

{"id":"ret:gpa-98-percent","subject":"rol:msds","statement":"RETRACTED. The academic-performance figure is GPA 4.0; '98%+ across all coursework' is not sourced anywhere.","short":"RETRACTED — 98%+ grades","reason":"Two different performance metrics for the same coursework, one of them unsourced and unverifiable even in principle, because a percentage grade average is not a figure the university publishes. Use clm:msds-gpa.","forbiddenPhrases":["98%+","98% +","98 percent","maintain 98"],"forbiddenPatterns":[],"retractedOn":"2026-09-02","previouslyAt":["backend/src/agent.py","backend/src/app.py (base_qa)"],"supersededBy":["clm:msds-gpa"],"note":null},

{"id":"ret:term-gpa-range","subject":"rol:msds","statement":"RETRACTED as a class. No individual term GPA is published anywhere on this site.","short":"RETRACTED — individual term GPAs","reason":"The deleted GPA-analysis page rendered a per-term GPA series. A cumulative 4.0 is the sourced, meaningful figure; a term-by-term series invites a reader to hunt for the low point, and the series itself has no source outside a page that is being removed. Enforced as a numeric range rather than a fixed string, because the offending value is any plausible term GPA, not one particular one.","forbiddenPhrases":["term GPA","GPA by quarter","quarterly GPA"],"forbiddenPatterns":[{"source":"\\bGPA\\W{0,12}(?:2\\.\\d|3\\.[0-9])\\b","flags":"i","why":"Addendum B R-19: any term GPA between 2.0 and 3.9 must never appear. The window is deliberately anchored to the literal word GPA so that ordinary decimals elsewhere on the page cannot trip it."}],"retractedOn":"2026-09-02","previouslyAt":["docs/index_gpa_analysis.html (deleted in this rebuild)","docs/js/gpa-analysis.js"],"supersededBy":["clm:msds-gpa"],"note":null},

{"id":"ret:kaggle-12th","subject":"per:duy","statement":"RETRACTED. No source supports a twelfth-place finish in a Kaggle medical image classification competition.","short":"RETRACTED — Kaggle 12th place","reason":"A competition placing is publicly checkable by leaderboard, which makes an unsourced one uniquely dangerous: the first recruiter who looks finds nothing. Assert it only with a link to that leaderboard, under a new claim.","forbiddenPhrases":["12th place","kaggle medical image","12th on kaggle"],"forbiddenPatterns":[],"retractedOn":"2026-09-02","previouslyAt":["backend/src/app.py (base_qa)","backend/src/agent.py"],"supersededBy":[],"note":null},

{"id":"ret:50-percent-efficiency","subject":"rol:faisal-lab","statement":"RETRACTED. No source supports 'medical documentation automation with 50% efficiency improvement'.","short":"RETRACTED — 50% efficiency improvement","reason":"The Faisal Lab work is sourced (clm:faisal-rag) but no efficiency figure attaches to it anywhere. A percentage with no measurement, no baseline and no denominator is the exact shape of claim this corpus exists to stop.","forbiddenPhrases":["50% efficiency","50 percent efficiency","physician workflows with 50"],"forbiddenPatterns":[],"retractedOn":"2026-09-02","previouslyAt":["backend/src/app.py (base_qa)","backend/src/agent.py"],"supersededBy":["clm:faisal-rag"],"note":null},

{"id":"ret:60-percent-labor","subject":"per:duy","statement":"RETRACTED. No source supports '60% labor cost reduction' for the garbage-classification project.","short":"RETRACTED — 60% labor cost reduction","reason":"A business-impact figure attached to a coursework model that was never deployed to a recycling facility. The model results are real and sourced (clm:garbage-model); the deployment and its savings are not.","forbiddenPhrases":["60% labor","60 percent labor","recycling facility deployment"],"forbiddenPatterns":[],"retractedOn":"2026-09-02","previouslyAt":["backend/src/app.py (base_qa)"],"supersededBy":["clm:garbage-model"],"note":null},

{"id":"ret:contact-window","subject":"per:duy","statement":"RETRACTED. No source supports an 'optimal customer contact window of 6-8 minutes', or the marketing-optimisation project it belongs to.","short":"RETRACTED — 6-8 minute contact window","reason":"Neither the finding nor the project appears in any current source. It is a fully invented result attached to a fully invented project.","forbiddenPhrases":["6-8 minutes","contact window","optimal contact"],"forbiddenPatterns":[],"retractedOn":"2026-09-02","previouslyAt":["backend/src/app.py (base_qa)"],"supersededBy":[],"note":null},

{"id":"ret:four-engineers","subject":"rol:blueprint","statement":"RETRACTED. No source supports 'collaborated with 4 engineers, a product lead, and domain experts' at SFU Blueprint.","short":"RETRACTED — team composition at Blueprint","reason":"A specific team composition is trivially checkable by a recruiter who calls the organisation. Say 'worked in a team', or restate it with a source.","forbiddenPhrases":["4 engineers","four engineers","collaborated with 4"],"forbiddenPatterns":[],"retractedOn":"2026-09-02","previouslyAt":["backend/src/app.py (base_qa)"],"supersededBy":["clm:mosaic-role"],"note":null},

{"id":"ret:summer-2026-availability","subject":"per:duy","statement":"RETRACTED. Every string offering availability for internships in the summer of 2026 is stale and contradicts the settled answer.","short":"RETRACTED — 2026 summer availability","reason":"That season is in the past as of September 2026, and the owner has since settled the real answer: graduation in June 2027 after 45 credits and the two-quarter capstone, open to both internships in the summer of 2027 and new-graduate roles starting mid-2027. A stale availability line is the single worst error on a job-hunt page, because it is the sentence that tells a recruiter what to do next. Use clm:availability.","forbiddenPhrases":["Summer 2026","Summer 2026 internship","May-August 2026","seeking: \"Summer 2026"],"forbiddenPatterns":[],"retractedOn":"2026-09-02","previouslyAt":["backend/src/app.py (base_qa)","backend/src/agent.py","public/docs/js/mcp-tools.js"],"supersededBy":["clm:availability"],"note":"The literal token 'Summer 2026' is forbidden outright, which is why every corpus statement about the Fischer role says 'the summer term' or 'summer of 2026' rather than the season-plus-year form. The constraint is on the string a reader could mistake for an availability offer, not on describing when work happened."},

{"id":"ret:yang-winter-2025","subject":"rol:yang-gra","statement":"RETRACTED. The research assistantship did not begin in winter 2025; that date on the resume is a typo.","short":"RETRACTED — Winter 2025 start date","reason":"The master's programme began in autumn 2025, so a winter 2025 start predates enrolment by a year. The owner has since given the real sequence: the relationship began in his Statistical Machine Learning I course, reading started over the following winter break, and experimentation began in the spring 2026 quarter and is ongoing. Use clm:yang-origin-course.","forbiddenPhrases":["Winter 2025"],"forbiddenPatterns":[],"retractedOn":"2026-09-02","previouslyAt":["docs/resume_content.html line 266 (as committed at 234cbcd)","public/docs/Resume.pdf"],"supersededBy":["clm:yang-origin-course","clm:yang-ongoing"],"note":"STILL PRESENT in public/docs/Resume.pdf as committed. The C9 gate runs over the PDF's extracted text precisely so that this does not stay quietly true."},